date,lecture,category,lesson,applied
2026-03-07,p360_lecture_08.01,Quarto syntax,"The # (h1) heading is Slide 1. The intro paragraph immediately below it is the slide body. <!-- Slide 1 --> goes after that paragraph, before the first --- separator. Miscounting here leads to slide total mismatches.",no
2026-03-07,p360_lecture_08.01,structure,A short recap slide (≤2 min) bridging from the previous lecture's limitations works better than jumping straight into new syntax. It gives students a motivation frame before content starts.,no
2026-03-07,p360_lecture_08.01,voice,"The instructor's PDF uses questions as slide titles (e.g. 'What's the big idea?', 'That sounds like an if statement…'). Apply this question-as-hook pattern more consistently on introductory slides — it mirrors the source material's style and pulls students in.",no
2026-03-07,p360_lecture_08.01,structure,"When a lecture introduces multiple variants of the same concept (e.g. three loop types), end with a 'which one to use?' decision framework before the lab. Students need synthesis before application — skipping it produces guessing, not reasoning.",no
2026-03-07,p360_lecture_08.01,structure,"The intro paragraph under a topic's # heading should appear on a separate ## slide with the same title, not on the # slide itself. In Reveal.js the # slide is a vertical navigation parent — putting content there makes it easy to skip.",no
2026-03-07,p360_lecture_08.01,structure,"When a slide needs both a concept explanation and a code example, use two consecutive ## slides with the same title: first slide has the concept as bullets, second slide has the code. This is the implementation of the 'no text on both sides of code' rule.",no
2026-03-07,p360_lecture_08.01,Quarto syntax,"Use ::: {.columns} / ::: {.column width=""50%""} / ::: / ::: for two-column layout. Code blocks inside columns require ```{.cpp} (dot notation) not ```cpp. Close each column with ::: and the outer container with ::: (trailing space). Use for side-by-side code comparison and multi-choice scenario slides.",no
2026-03-07,p360_lecture_08.01,structure,"When you have a code example do not have text on the same page unless the example is very short (<6 lines). Even then, have text either above or below the code example but not both. It’s OK to add another slide if needed.",no
2026-03-07,p360_lecture_08.01,structure,Prefer lists to blocks of text.,